{
  "schemaVersion": 1,
  "editionId": "1668863030-2026-week-05",
  "league": {
    "leagueId": "1668863030",
    "name": "Sundays Are For The Girls",
    "season": 2026,
    "timezone": "America/New_York"
  },
  "week": {
    "number": 5,
    "startsAt": "2026-01-29T00:00:00.000Z",
    "endsAt": "2026-10-13T22:31:02.735Z",
    "sourceStatus": "final"
  },
  "publishedAt": "2026-10-13T22:00:00.000Z",
  "rankingSource": {
    "type": "commissioner",
    "commissioner": "Jessica",
    "submissionPath": "data/rankings/2026/week-05.json"
  },
  "entries": [
    {
      "teamId": "6",
      "displayName": "Shannon’s Serving Punt",
      "rank": 1,
      "previousRank": 1,
      "movement": 0,
      "record": {
        "wins": 5,
        "losses": 0,
        "ties": 0,
        "pointsFor": 658.86,
        "pointsAgainst": 450.3
      },
      "weeklyScore": 111.74,
      "winningStreak": 5,
      "explanation": "Still undefeated and holding the top spot.",
      "badgeIds": []
    },
    {
      "teamId": "10",
      "displayName": "Pitts Out For the Boys",
      "rank": 2,
      "previousRank": 2,
      "movement": 0,
      "record": {
        "wins": 5,
        "losses": 0,
        "ties": 0,
        "pointsFor": 672.64,
        "pointsAgainst": 527.36
      },
      "weeklyScore": 181.36,
      "winningStreak": 5,
      "explanation": "A league-leading score keeps this undefeated team at number two.",
      "badgeIds": [
        "scoreboard-scorcher",
        "steamroller"
      ]
    },
    {
      "teamId": "3",
      "displayName": "Slayday Barbie",
      "rank": 3,
      "previousRank": 3,
      "movement": 0,
      "record": {
        "wins": 4,
        "losses": 1,
        "ties": 0,
        "pointsFor": 661.76,
        "pointsAgainst": 401.68
      },
      "weeklyScore": 110.18,
      "winningStreak": 3,
      "explanation": "A fourth win keeps this team firmly in the top three.",
      "badgeIds": []
    },
    {
      "teamId": "13",
      "displayName": "Milk These TDs",
      "rank": 4,
      "previousRank": 4,
      "movement": 0,
      "record": {
        "wins": 4,
        "losses": 1,
        "ties": 0,
        "pointsFor": 615.28,
        "pointsAgainst": 493
      },
      "weeklyScore": 145.6,
      "winningStreak": 3,
      "explanation": "Three straight wins secure another week in the top four.",
      "badgeIds": [
        "three-peat-treat"
      ]
    },
    {
      "teamId": "11",
      "displayName": "Sammy's Ball Handlers",
      "rank": 5,
      "previousRank": 5,
      "movement": 0,
      "record": {
        "wins": 3,
        "losses": 2,
        "ties": 0,
        "pointsFor": 551.1800000000001,
        "pointsAgainst": 557.12
      },
      "weeklyScore": 129.06,
      "winningStreak": 3,
      "explanation": "A third consecutive win preserves the number-five ranking.",
      "badgeIds": []
    },
    {
      "teamId": "16",
      "displayName": "back that pass up",
      "rank": 6,
      "previousRank": 6,
      "movement": 0,
      "record": {
        "wins": 3,
        "losses": 2,
        "ties": 0,
        "pointsFor": 540.64,
        "pointsAgainst": 568.24
      },
      "weeklyScore": 118.3,
      "winningStreak": 1,
      "explanation": "A Week 5 victory holds this team in the upper tier.",
      "badgeIds": []
    },
    {
      "teamId": "9",
      "displayName": "I Love Kevin’s Tight End",
      "rank": 7,
      "previousRank": 9,
      "movement": 2,
      "record": {
        "wins": 2,
        "losses": 3,
        "ties": 0,
        "pointsFor": 508.42,
        "pointsAgainst": 628.58
      },
      "weeklyScore": 119.5,
      "winningStreak": 0,
      "explanation": "A strong losing score still earns a two-place rise.",
      "badgeIds": []
    },
    {
      "teamId": "7",
      "displayName": "sacks in the city",
      "rank": 8,
      "previousRank": 7,
      "movement": -1,
      "record": {
        "wins": 2,
        "losses": 3,
        "ties": 0,
        "pointsFor": 526.04,
        "pointsAgainst": 636.2199999999999
      },
      "weeklyScore": 68.44,
      "winningStreak": 0,
      "explanation": "A difficult loss results in a one-place slide.",
      "badgeIds": []
    },
    {
      "teamId": "1",
      "displayName": "The Waffles Special",
      "rank": 9,
      "previousRank": 10,
      "movement": 1,
      "record": {
        "wins": 1,
        "losses": 4,
        "ties": 0,
        "pointsFor": 529.72,
        "pointsAgainst": 565.88
      },
      "weeklyScore": 97.82,
      "winningStreak": 0,
      "explanation": "The rankings offer a small rise despite the loss.",
      "badgeIds": []
    },
    {
      "teamId": "15",
      "displayName": "glizzie gambler",
      "rank": 10,
      "previousRank": 14,
      "movement": 4,
      "record": {
        "wins": 1,
        "losses": 4,
        "ties": 0,
        "pointsFor": 520.52,
        "pointsAgainst": 545.8
      },
      "weeklyScore": 100.94,
      "winningStreak": 0,
      "explanation": "A competitive Week 5 performance drives a four-place climb.",
      "badgeIds": []
    },
    {
      "teamId": "2",
      "displayName": "The Brotherly Shovers",
      "rank": 11,
      "previousRank": 12,
      "movement": 1,
      "record": {
        "wins": 1,
        "losses": 4,
        "ties": 0,
        "pointsFor": 559.68,
        "pointsAgainst": 597.92
      },
      "weeklyScore": 126.22,
      "winningStreak": 0,
      "explanation": "A high-scoring loss still brings a slight rise.",
      "badgeIds": [
        "hard-luck-hero"
      ]
    },
    {
      "teamId": "5",
      "displayName": "Unnecessary Roughness",
      "rank": 12,
      "previousRank": 11,
      "movement": -1,
      "record": {
        "wins": 1,
        "losses": 4,
        "ties": 0,
        "pointsFor": 443.28,
        "pointsAgainst": 617.22
      },
      "weeklyScore": 61.4,
      "winningStreak": 0,
      "explanation": "The week's lowest score produces another drop.",
      "badgeIds": [
        "basement-dweller"
      ]
    },
    {
      "teamId": "14",
      "displayName": "Girls Just Wanna Have TDs",
      "rank": 13,
      "previousRank": 16,
      "movement": 3,
      "record": {
        "wins": 2,
        "losses": 3,
        "ties": 0,
        "pointsFor": 378.19999999999993,
        "pointsAgainst": 537.3199999999999
      },
      "weeklyScore": 74.66,
      "winningStreak": 2,
      "explanation": "A second straight win lifts this team three places.",
      "badgeIds": [
        "cardiac-queen"
      ]
    },
    {
      "teamId": "8",
      "displayName": "Whisk Takers",
      "rank": 14,
      "previousRank": 8,
      "movement": -6,
      "record": {
        "wins": 2,
        "losses": 3,
        "ties": 0,
        "pointsFor": 492.86,
        "pointsAgainst": 453.65999999999997
      },
      "weeklyScore": 72.9,
      "winningStreak": 0,
      "explanation": "A narrow loss sends this team down the board.",
      "badgeIds": []
    },
    {
      "teamId": "4",
      "displayName": "McConkey-Tonk Badonkadonk",
      "rank": 15,
      "previousRank": 15,
      "movement": 0,
      "record": {
        "wins": 2,
        "losses": 3,
        "ties": 0,
        "pointsFor": 474.78,
        "pointsAgainst": 555.3399999999999
      },
      "weeklyScore": 119.64,
      "winningStreak": 1,
      "explanation": "A convincing win keeps this team ahead of the basement.",
      "badgeIds": []
    },
    {
      "teamId": "12",
      "displayName": "Hail Marys",
      "rank": 16,
      "previousRank": 13,
      "movement": -3,
      "record": {
        "wins": 2,
        "losses": 3,
        "ties": 0,
        "pointsFor": 530.28,
        "pointsAgainst": 528.5
      },
      "weeklyScore": 110.12,
      "winningStreak": 0,
      "explanation": "A Week 5 loss lands this team at the bottom of the rankings.",
      "badgeIds": []
    }
  ],
  "badges": [
    {
      "badgeId": "scoreboard-scorcher",
      "teamId": "10",
      "reason": "Led the league with 181.36 points.",
      "metric": 181.36
    },
    {
      "badgeId": "basement-dweller",
      "teamId": "5",
      "reason": "Posted the week's low score of 61.40.",
      "metric": 61.4
    },
    {
      "badgeId": "steamroller",
      "teamId": "10",
      "reason": "Won by 61.86 points.",
      "metric": 61.860000000000014
    },
    {
      "badgeId": "hard-luck-hero",
      "teamId": "2",
      "reason": "Scored 126.22 points and still lost.",
      "metric": 126.22
    },
    {
      "badgeId": "cardiac-queen",
      "teamId": "14",
      "reason": "Survived the week's closest finish by 1.76 points.",
      "metric": 1.759999999999991
    },
    {
      "badgeId": "three-peat-treat",
      "teamId": "13",
      "reason": "Led all teams earning a third straight win with 145.60 points.",
      "metric": 145.6
    }
  ],
  "previousEditionId": "1668863030-2026-week-04"
}
